--
-- https://github.com/scylladb/scylla/issues/5935
-- crash if all_replicas is empty test we work well when the list of
-- natural endpoints is empty
--
CREATE KEYSPACE t WITH REPLICATION = { 'class' : 'NetworkTopologyStrategy', 'nosuchdc' : 3 } AND DURABLE_WRITES =  true;
{
	"status" : "ok"
}
CREATE TABLE t.t (a INT PRIMARY KEY, b int);
{
	"status" : "ok"
}
INSERT INTO t.t (a, b) VALUES (1, 1);
{
	"message" : "exceptions::unavailable_exception (Cannot achieve consistency level for cl ONE. Requires 1, alive 0)",
	"status" : "error"
}
INSERT INTO t.t (a, b) VALUES (2, 2);
{
	"message" : "exceptions::unavailable_exception (Cannot achieve consistency level for cl ONE. Requires 1, alive 0)",
	"status" : "error"
}
SELECT * FROM t.t ALLOW FILTERING;
{
	"message" : "exceptions::unavailable_exception (Cannot achieve consistency level for cl ONE. Requires 1, alive 0)",
	"status" : "error"
}
-- This statement used to trigger a crash
SELECT a FROM t.t WHERE a IN (1, 2);
{
	"message" : "exceptions::unavailable_exception (Cannot achieve consistency level for cl ONE. Requires 1, alive 0)",
	"status" : "error"
}
DELETE FROM t.t WHERE a = 1;
{
	"message" : "exceptions::unavailable_exception (Cannot achieve consistency level for cl ONE. Requires 1, alive 0)",
	"status" : "error"
}
DELETE FROM t.t WHERE a = 2;
{
	"message" : "exceptions::unavailable_exception (Cannot achieve consistency level for cl ONE. Requires 1, alive 0)",
	"status" : "error"
}
CREATE INDEX b ON t.t (b);
{
	"status" : "ok"
}
SELECT * FROM t.t WHERE b=2;
{
	"message" : "exceptions::unavailable_exception (Cannot achieve consistency level for cl ONE. Requires 1, alive 0)",
	"status" : "error"
}
INSERT INTO t.t (a) VALUES (1) IF NOT EXISTS;
{
	"message" : "exceptions::unavailable_exception (Cannot achieve consistency level for cl SERIAL. Requires 1, alive 0)",
	"status" : "error"
}
DELETE FROM t.t WHERE a=1 IF EXISTS;
{
	"message" : "exceptions::unavailable_exception (Cannot achieve consistency level for cl SERIAL. Requires 1, alive 0)",
	"status" : "error"
}
CREATE MATERIALIZED VIEW t.mv AS SELECT a, b FROM t.t WHERE b > 1 PRIMARY KEY (b, a);
{
	"status" : "ok"
}
SELECT * FROM t.mv WHERE b IN (2, 1);
{
	"message" : "exceptions::unavailable_exception (Cannot achieve consistency level for cl ONE. Requires 1, alive 0)",
	"status" : "error"
}
DROP MATERIALIZED VIEW t.mv;
{
	"status" : "ok"
}
DROP TABLE t.t;
{
	"status" : "ok"
}
DROP KEYSPACE t;
{
	"status" : "ok"
}
--
-- https://github.com/scylladb/scylla/issues/5962
-- wrong de-facto replication factor
-- when RF=0 and SimpleStrategy
--
CREATE KEYSPACE t WITH REPLICATION = { 'class' : 'SimpleStrategy', 'replication_factor' : 0 } AND DURABLE_WRITES =  true;
{
	"status" : "ok"
}
CREATE TABLE t.t (a INT PRIMARY KEY, b int);
{
	"status" : "ok"
}
INSERT INTO t.t (a, b) VALUES (1, 1);
{
	"message" : "exceptions::unavailable_exception (Cannot achieve consistency level for cl ONE. Requires 1, alive 0)",
	"status" : "error"
}
INSERT INTO t.t (a, b) VALUES (2, 2);
{
	"message" : "exceptions::unavailable_exception (Cannot achieve consistency level for cl ONE. Requires 1, alive 0)",
	"status" : "error"
}
SELECT * FROM t.t ALLOW FILTERING;
{
	"message" : "exceptions::unavailable_exception (Cannot achieve consistency level for cl ONE. Requires 1, alive 0)",
	"status" : "error"
}
-- This statement used to trigger a crash
SELECT a FROM t.t WHERE a IN (1, 2);
{
	"message" : "exceptions::unavailable_exception (Cannot achieve consistency level for cl ONE. Requires 1, alive 0)",
	"status" : "error"
}
DELETE FROM t.t WHERE a = 1;
{
	"message" : "exceptions::unavailable_exception (Cannot achieve consistency level for cl ONE. Requires 1, alive 0)",
	"status" : "error"
}
DELETE FROM t.t WHERE a = 2;
{
	"message" : "exceptions::unavailable_exception (Cannot achieve consistency level for cl ONE. Requires 1, alive 0)",
	"status" : "error"
}
CREATE INDEX b ON t.t (b);
{
	"status" : "ok"
}
SELECT * FROM t.t WHERE b=2;
{
	"message" : "exceptions::unavailable_exception (Cannot achieve consistency level for cl ONE. Requires 1, alive 0)",
	"status" : "error"
}
INSERT INTO t.t (a) VALUES (1) IF NOT EXISTS;
{
	"message" : "exceptions::unavailable_exception (Cannot achieve consistency level for cl SERIAL. Requires 1, alive 0)",
	"status" : "error"
}
DELETE FROM t.t WHERE a=1 IF EXISTS;
{
	"message" : "exceptions::unavailable_exception (Cannot achieve consistency level for cl SERIAL. Requires 1, alive 0)",
	"status" : "error"
}
CREATE MATERIALIZED VIEW t.mv AS SELECT a, b FROM t.t WHERE b > 1 PRIMARY KEY (b, a);
{
	"status" : "ok"
}
SELECT * FROM t.mv WHERE b IN (2, 1);
{
	"message" : "exceptions::unavailable_exception (Cannot achieve consistency level for cl ONE. Requires 1, alive 0)",
	"status" : "error"
}
DROP MATERIALIZED VIEW t.mv;
{
	"status" : "ok"
}
DROP TABLE t.t;
{
	"status" : "ok"
}
DROP KEYSPACE t;
{
	"status" : "ok"
}
